{
  "format": "arcane.clip",
  "frames": [
    {
      "duration_seconds": 0.1,
      "uv": [
        0.5,
        0.0,
        0.75,
        1.0
      ]
    },
    {
      "duration_seconds": 0.1,
      "uv": [
        0.75,
        0.0,
        1.0,
        1.0
      ]
    }
  ],
  "loop": true,
  "name": "run",
  "version": 2
}
